{
  "$schema": "https://json-schema.org/draft/2020-12/schema",
  "$id": "https://ai-native-methodology/schemas/test-spec.schema.json",
  "title": "Test Spec (chain test / 테스트 명세 + 실 test 코드 메타)",
  "description": "v2.0 chain harness 의 test stage 산출물. acceptance-criteria 기반 실 test 코드 자동 생성 (RED 의무). 5종 물증 7 필드 (no-simulation 강화). DEC-2026-05-06-v2.0-i-strict-채택 정합. v11.0.0 MAJOR 확장 (DEC-2026-05-26-contract-강제-양-axis §1 layer 3 hard gate) — test_cases[].framework hint 확장 (schemathesis/dredd/pact/playwright-visual/axe-core/percy/chromatic 추가) + openapi_contract_ref (BE contract framework 본격 required) + visual_regression_ref (FE visual framework 본격 required) 본격 if/then.",
  "type": "object",
  "required": ["meta", "derivation_source", "test_cases", "coverage"],
  "additionalProperties": false,
  "properties": {
    "meta": {
      "$ref": "./meta-confidence.schema.json"
    },
    "derivation_source": {
      "type": "object",
      "required": ["acceptance_criteria_path", "behavior_spec_path"],
      "additionalProperties": false,
      "properties": {
        "acceptance_criteria_path": {"type": "string"},
        "behavior_spec_path": {"type": "string"}
      }
    },
    "test_cases": {
      "type": "array",
      "minItems": 1,
      "items": {
        "type": "object",
        "required": ["id", "bhv_ref", "type", "framework", "source_file", "expected_outcome"],
        "additionalProperties": false,
        "$comment": "v0.36.0 — ac_ref 가 top-required 에서 빠짐 (DEC-2026-06-11-tdd-unit-layer-thread). 대신 allOf if/then 으로 조건부: test_layer=unit TC 는 class_ref 의무·ac_ref optional (유닛테스트는 AC 없이 정당) / 그 외(composition / test_layer 부재=기본) 는 ac_ref 의무 = 기존 PoC 무회귀.",
        "properties": {
          "id": {
            "type": "string",
            "pattern": "^TC-[A-Z0-9_-]+-[0-9]{3}$"
          },
          "ac_ref": {
            "type": "string",
            "pattern": "^AC-[A-Z0-9_-]+-[0-9]{3}$",
            "description": "chain spec backward link (composition TC 의무 / test_layer=unit TC 는 optional — allOf if/then)"
          },
          "bhv_ref": {
            "type": "string",
            "pattern": "^BHV-[A-Z0-9_-]+-[0-9]{3}$"
          },
          "type": {
            "type": "string",
            "enum": ["unit", "integration", "contract", "e2e", "property", "mutation", "security", "load", "visual", "a11y"],
            "description": "B4 — 8 → 10 enum 확장 (visual + a11y 추가 / v11.0.0 contract 강제 양 axis 정합). contract = BE openapi 정합 / visual = FE visual regression / a11y = FE accessibility (WCAG)"
          },
          "framework": {
            "type": "string",
            "description": "B3 open enum — 사내 stack 추가 시 schema 변경 ❌ / hint = jest/vitest/jasmine/mocha/junit5/pytest/rspec/gotest/playwright/cypress/supertest/testcontainers/schemathesis/dredd/pact/spring-cloud-contract/playwright-visual/axe-core/percy/chromatic 등. v11.0.0 — BE contract framework (schemathesis/dredd/pact/spring-cloud-contract) 시 openapi_contract_ref 본격 required / FE visual framework (playwright-visual/axe-core/percy/chromatic) 시 visual_regression_ref 본격 required (allOf if/then)."
          },
          "framework_status": {
            "type": "string",
            "enum": ["active", "maintenance", "deprecated"],
            "default": "active",
            "description": "Industry — jqwik maintenance mode 경고 (B3)"
          },
          "source_file": {
            "type": "string",
            "description": "실 test 코드 파일 경로 (예: src/test/java/UserSignupTest.java)"
          },
          "source_evidence": {
            "type": "string",
            "description": "no-simulation — test 코드 excerpt (≤ 500 char) / 실 코드가 source_file 에 존재함을 입증"
          },
          "expected_outcome": {
            "type": "string",
            "enum": ["pass", "fail"],
            "description": "chain test RED 의무 = 'fail' (impl 부재 / chain impl GREEN 시 'pass' 격상)"
          },
          "test_intent": {
            "type": "string",
            "enum": ["characterization", "augmentation"],
            "description": "v11.11.0 — use-scenario S2(AX전환) gate (C-use-scenario-s2-gate / DEC-2026-05-30-s2-gate-slice). characterization = 기존 legacy 동작 포착 (in-place 증강 시 expected_outcome='pass' 정합 / legacy 코드 존재 → GREEN 기대) / augmentation = 신규 증강분 (impl 부재 → expected_outcome='fail'(test stage) RED 정합). optional (additive / S2 외 시나리오 미사용 / 미지정 = aggregate 매트릭스 fallback). gate per_tc_outcome 분기가 expected_outcome ↔ test_intent 정합으로 characterization GREEN + augmentation RED 혼합을 검증."
          },
          "fail_mode": {
            "type": "string",
            "enum": ["compile_import_fail", "assertion_fail", "dry_run_placeholder", "pending"],
            "description": "F-SIM-005 P1 본격 흡수 (v8.14.0 / DEC-2026-05-23-fsim-005-corroboration-2-genuine). per-TC RED granularity 의무화. compile_import_fail = Beck-canonical 정합 (Kent Beck 2002 preface p.x verbatim 'test doesn't even compile at first') / assertion_fail = per-TC RED 표준 / dry_run_placeholder = corroboration 자격 ❌ (Adzic SBE 10년 폐기 함정 직접 회피 — gojko.net/2020/03/17/sbe-10-years.html) / pending = Cucumber yellow (skipped) 정합 (Senior REVISE-1 추가 권고). expected_outcome='fail' 시 권고 (optional / chain test RED granularity 입증). expected_outcome='pass' (chain impl GREEN) 시 미사용."
          },
          "impl_module_ref": {
            "type": "string",
            "pattern": "^IMPL-[A-Z0-9_-]+-[0-9]{3}$",
            "description": "chain impl forward link (chain test RED 시 미정 / chain impl GREEN 시 채움)"
          },
          "code_pointers": {
            "type": "array",
            "description": "operation.md 결정 3 + P2 — artifact ↔ code anchor. graph-synthesizer 가 평탄화 / code-pointer-validator 가 검증.",
            "items": {"$ref": "./code-pointer.schema.json"}
          },
          "code_pointers_na": {
            "type": "boolean",
            "default": false,
            "description": "명시적 N/A 마커 (operation.md 결정 3)."
          },
          "test_layer": {
            "type": "string",
            "enum": ["unit", "composition"],
            "description": "v0.36.0 신설 (DEC-2026-06-11-tdd-unit-layer-thread). 피라미드 *위치* axis — `type`(technique: unit/integration/property/...)과 **별 axis**. unit = 단일 UNIT-* 격리 검증(빌딩블록 / TDD 층) / composition = 협력자 조합·mock(BDD 시나리오 / AC 검증). 미지정 = composition(기본 / 기존 PoC 무회귀 — test_layer 부재 시 ac_ref 의무 유지). unit 시 class_ref 의무(allOf if/then)."
          },
          "class_ref": {
            "type": "string",
            "pattern": "^UNIT-[A-Z0-9_-]+-[0-9]{3}$",
            "description": "v0.36.0 신설 — test_layer=unit TC 가 검증하는 UNIT-* (unit-spec.json). 기존 class_ref/method_ref 원시필드 대신 UNIT-* 노드 참조 + 실 코드 좌표는 code_pointers(ast_symbol)가 보유(결정 4 / SSOT). test_layer=unit 시 required(allOf if/then)."
          },
          "mocks": {
            "type": "array",
            "description": "v0.36.0 신설 — 본 TC(주로 composition)가 mock 하는 협력자 UNIT-* 목록. mocking-soundness 계약: mock 한 collaborator 는 자기 test_layer=unit TC 로 핀될 때만 건전(spec-test-link validateMockSoundness / v0.40.0 HARD 차단 / DEC-2026-06-12-unit-layer-hard-flip). 그 협력자가 unit_test_obligation=waived 면 면제. Fowler 'Mocks Aren't Stubs'의 위험('green but mask inherent errors') + Consumer-Driven Contracts 정신의 본 방법론 합성.",
            "items": {
              "type": "object",
              "required": ["collaborator_unit_ref"],
              "additionalProperties": false,
              "properties": {
                "collaborator_unit_ref": {
                  "type": "string",
                  "pattern": "^UNIT-[A-Z0-9_-]+-[0-9]{3}$",
                  "description": "mock 된 협력자 UNIT-* (unit-spec.units[].collaborators 와 정합)."
                },
                "mock_kind": {
                  "type": "string",
                  "enum": ["stub", "mock", "spy", "fake"],
                  "description": "Fowler test double 분류 (stub=상태 / mock=행위 검증 / spy=기록 / fake=경량 구현)."
                }
              }
            }
          },
          "openapi_contract_ref": {
            "type": "object",
            "description": "v11.0.0 신설 (DEC-2026-05-26-contract-강제-양-axis §1 layer 3 hard gate). BE contract framework (schemathesis/dredd/pact/spring-cloud-contract) 시 본격 required (allOf if/then).",
            "required": ["path", "operationId"],
            "additionalProperties": false,
            "properties": {
              "path": {
                "type": "string",
                "description": "OpenAPI path (예: /api/password-change)"
              },
              "operationId": {
                "type": "string",
                "description": "OpenAPI operationId (예: changePassword)"
              },
              "method": {
                "type": "string",
                "enum": ["get", "post", "put", "patch", "delete", "head", "options"]
              },
              "contract_file": {
                "type": "string",
                "description": "Pact contract file path 또는 spring-cloud-contract DSL file path (선택)"
              }
            }
          },
          "visual_regression_ref": {
            "type": "object",
            "description": "v11.0.0 신설 (DEC-2026-05-26-contract-강제-양-axis §1 layer 3 hard gate). FE visual framework (playwright-visual/axe-core/percy/chromatic) 시 본격 required (allOf if/then).",
            "required": ["screen"],
            "additionalProperties": false,
            "properties": {
              "screen": {
                "type": "string",
                "description": "screen 또는 component name (예: PasswordChangeForm)"
              },
              "state_map_ref": {
                "type": "string",
                "description": "state-map.json 안 state id (예: PasswordChangeForm.idle / loading / error)"
              },
              "dtcg_token_set": {
                "type": "string",
                "description": "DTCG W3C token set (예: default / dark)"
              },
              "baseline_screenshot": {
                "type": "string",
                "description": "baseline screenshot path (visual regression diff anchor)"
              },
              "viewports": {
                "type": "array",
                "items": {"type": "string"},
                "description": "viewport list (예: ['1280x720', '375x667'])"
              }
            }
          },
          "test_run_evidence": {
            "type": "object",
            "description": "no-simulation 5종 물증 7 필드 (B5 정합 / 정규화)",
            "required": ["test_runner_version", "test_runner_stdout_path", "invocation_timestamp", "duration_ms", "pass_count", "fail_count", "skip_count", "reproduction_command", "result_hash", "report_format"],
            "additionalProperties": false,
            "properties": {
              "test_runner_version": {"type": "string", "description": "실 runner --version 출력 (예: jest 29.7.0)"},
              "test_runner_stdout_path": {"type": "string", "description": "stdout dump 경로 (불변 보존)"},
              "test_runner_stderr_path": {"type": "string", "description": "B5 optional / non-empty if present"},
              "invocation_timestamp": {"type": "string", "format": "date-time"},
              "duration_ms": {"type": "integer", "minimum": 0},
              "pass_count": {"type": "integer", "minimum": 0},
              "fail_count": {"type": "integer", "minimum": 0},
              "skip_count": {"type": "integer", "minimum": 0},
              "reproduction_command": {
                "oneOf": [
                  {"type": "string"},
                  {"type": "array", "items": {"type": "string"}, "minItems": 1}
                ],
                "description": "B5 array 허용 — multi-step 명령 (e.g., docker compose up && pytest)"
              },
              "result_hash": {
                "type": "string",
                "pattern": "^sha256:[a-f0-9]{64}$",
                "description": "B5 정규화 — hash 대상 = stdout 의 (timestamp+duration_ms 제외 / sorted test names + pass/fail/skip count)"
              },
              "report_format": {
                "type": "string",
                "enum": ["sarif_2_1_0", "junit_xml", "jest_json", "pytest_json", "vitest_json", "lcov", "cobertura_xml", "jacoco_xml", "stdout_regex"],
                "description": "B5 — SARIF 2.1.0 (OASIS / GitHub Code Scanning native) 우선 권고. v11.19 stdout_regex = test-cmd `stdout-regex`(framework:other) 정규화 대응 (T14 / honesty — stdout 파싱 결과를 *_json 거짓 라벨 ❌)"
              },
              "flaky_retries_count": {
                "type": "integer",
                "minimum": 0,
                "default": 0,
                "description": "ADR-CHAIN-004 §5 — Playwright 정합 per-test cap 2. 본 필드 = 실제 retry 발생 횟수 누적 (정상 1회 통과 = 0). 3회+ retry = 진짜 fail / fail_count 증가."
              }
            }
          }
        },
        "allOf": [
          {
            "$comment": "v11.0.0 if/then — framework in BE contract 4종 (schemathesis/dredd/pact/spring-cloud-contract) 시 openapi_contract_ref 본격 required (DEC-2026-05-26-contract-강제-양-axis §1 layer 3 hard gate).",
            "if": {
              "properties": {
                "framework": {
                  "enum": ["schemathesis", "dredd", "pact", "spring-cloud-contract"]
                }
              },
              "required": ["framework"]
            },
            "then": {
              "required": ["openapi_contract_ref"]
            }
          },
          {
            "$comment": "v11.0.0 if/then — framework in FE visual/a11y 4종 (playwright-visual/axe-core/percy/chromatic) 시 visual_regression_ref 본격 required.",
            "if": {
              "properties": {
                "framework": {
                  "enum": ["playwright-visual", "axe-core", "percy", "chromatic"]
                }
              },
              "required": ["framework"]
            },
            "then": {
              "required": ["visual_regression_ref"]
            }
          },
          {
            "$comment": "v0.36.0 if/then (DEC-2026-06-11-tdd-unit-layer-thread) — test_layer=unit TC 는 class_ref 의무(ac_ref optional / 유닛테스트는 AC 없이 정당). else(composition / test_layer 부재=기본)는 ac_ref 의무 = 기존 PoC 무회귀(test_layer 미지정 시 if 의 required:[test_layer] 실패 → else 진입 → ac_ref 강제).",
            "if": {
              "properties": {"test_layer": {"const": "unit"}},
              "required": ["test_layer"]
            },
            "then": {
              "required": ["class_ref"]
            },
            "else": {
              "required": ["ac_ref"]
            }
          }
        ]
      }
    },
    "coverage": {
      "type": "object",
      "description": "Blocker 2 해결안 — 3 metric 분리",
      "required": ["link_coverage"],
      "additionalProperties": false,
      "properties": {
        "link_coverage": {
          "type": "object",
          "description": "AC-* / BHV-* / UC-* 가 ≥ 1 TC-* 에 ref 되는 비율 (chain 정합 의무)",
          "required": ["by_acceptance_criteria", "threshold"],
          "additionalProperties": false,
          "properties": {
            "by_acceptance_criteria": {"type": "number", "minimum": 0, "maximum": 1},
            "by_business_rule": {"type": "number", "minimum": 0, "maximum": 1},
            "by_use_case": {"type": "number", "minimum": 0, "maximum": 1},
            "threshold": {
              "type": "number",
              "minimum": 0.85,
              "maximum": 0.95,
              "description": "ADR-010 v2 ratchet 0.85 → 0.90 → 0.95"
            },
            "severity_floor": {
              "type": "object",
              "description": "DO-178C DAL A 차용 (Official research 권고)",
              "additionalProperties": false,
              "properties": {
                "critical": {"type": "number", "const": 1.0},
                "high": {"type": "number", "minimum": 0.95, "maximum": 1.0},
                "medium": {"type": "number", "minimum": 0.90, "maximum": 1.0},
                "low": {"type": "number", "minimum": 0.85, "maximum": 1.0}
              }
            }
          }
        },
        "test_pass_rate": {
          "type": "number",
          "minimum": 0,
          "maximum": 1,
          "description": "chain test = 0.0 (RED 의무) / chain impl = 1.0 (GREEN 의무 / gate #impl) — 본 schema 는 chain test 단계 / chain impl 은 impl-spec 에서 1.0 의무"
        },
        "line_coverage": {
          "type": "number",
          "minimum": 0,
          "maximum": 1,
          "description": "optional secondary metric (LCOV / JaCoCo)"
        },
        "branch_coverage": {
          "type": "number",
          "minimum": 0,
          "maximum": 1,
          "description": "optional secondary metric"
        }
      }
    },
    "chain_attempt": {
      "type": "object",
      "description": "Industry research — retry cap (SOTA pass rate gap 봉쇄)",
      "additionalProperties": false,
      "properties": {
        "attempt_n": {"type": "integer", "minimum": 1},
        "retry_cap": {"type": "integer", "minimum": 1, "default": 3},
        "revisit_count": {"type": "integer", "minimum": 0, "default": 0}
      }
    }
  }
}
