{
  "meta": {
    "generated_at": "2026-05-06T17:00:00Z",
    "methodology_version": "v2.0.0",
    "inputs_used": ["source_code", "design_specs"],
    "confidence": 0.95,
    "formula_version": "v1"
  },
  "derivation_source": {
    "acceptance_criteria_path": ".aimd/output/acceptance-criteria.json",
    "behavior_spec_path": ".aimd/output/behavior-spec.json"
  },
  "test_cases": [
    {
      "id": "TC-USER-001",
      "ac_ref": "AC-USER-001",
      "bhv_ref": "BHV-USER-001",
      "type": "unit",
      "framework": "vitest",
      "framework_status": "active",
      "source_file": "target/src/user.service.test.ts",
      "source_evidence": "describe('TC-USER-001 — register (UC-USER-001 / AC-USER-001 / BHV-USER-001)', () => { it('happy path...'); it('이메일 중복 시 EmailDuplicateError throw...'); it('비밀번호 < 8자 시 PasswordTooShortError throw...'); });",
      "expected_outcome": "fail",
      "fail_mode": "assertion_fail",
      "test_run_evidence": {
        "test_runner_version": "vitest 1.6.1",
        "test_runner_stdout_path": ".aimd/output/evidence/test-stdout-red.txt",
        "test_runner_stderr_path": ".aimd/output/evidence/test-stderr-red.txt",
        "invocation_timestamp": "2026-05-06T16:50:20Z",
        "duration_ms": 320,
        "pass_count": 0,
        "fail_count": 1,
        "skip_count": 0,
        "reproduction_command": "cd target && npx vitest run --reporter=json --outputFile=../.aimd/output/evidence/vitest-red.json",
        "result_hash": "sha256:4ebbe9e1cd5de413ad39a8df6ff0e0e4c202fc962e39e18a29e2c5fda6f5d865",
        "report_format": "vitest_json",
        "flaky_retries_count": 0
      }
    },
    {
      "id": "TC-USER-002",
      "ac_ref": "AC-USER-002",
      "bhv_ref": "BHV-USER-002",
      "type": "unit",
      "framework": "vitest",
      "framework_status": "active",
      "source_file": "target/src/user.service.test.ts",
      "source_evidence": "describe('TC-USER-002 — login (UC-USER-002 / AC-USER-002 / BHV-USER-002)', () => { it('happy path — 일치 시 user 반환'); it('비밀번호 불일치 시 null'); it('사용자 없음 시 null'); });",
      "expected_outcome": "fail",
      "fail_mode": "assertion_fail",
      "test_run_evidence": {
        "test_runner_version": "vitest 1.6.1",
        "test_runner_stdout_path": ".aimd/output/evidence/test-stdout-red.txt",
        "test_runner_stderr_path": ".aimd/output/evidence/test-stderr-red.txt",
        "invocation_timestamp": "2026-05-06T16:50:20Z",
        "duration_ms": 320,
        "pass_count": 0,
        "fail_count": 1,
        "skip_count": 0,
        "reproduction_command": "cd target && npx vitest run --reporter=json --outputFile=../.aimd/output/evidence/vitest-red.json",
        "result_hash": "sha256:4ebbe9e1cd5de413ad39a8df6ff0e0e4c202fc962e39e18a29e2c5fda6f5d865",
        "report_format": "vitest_json",
        "flaky_retries_count": 0
      }
    }
  ],
  "coverage": {
    "link_coverage": {
      "by_acceptance_criteria": 1.0,
      "by_business_rule": 1.0,
      "by_use_case": 1.0,
      "threshold": 0.85,
      "severity_floor": {
        "critical": 1.0,
        "high": 1.0,
        "medium": 1.0,
        "low": 1.0
      }
    },
    "test_pass_rate": 0.0,
    "line_coverage": 0.0,
    "branch_coverage": 0.0
  },
  "chain_attempt": {
    "attempt_n": 1,
    "retry_cap": 3,
    "revisit_count": 0
  }
}
