{
  "meta": {
    "generated_at": "2026-06-06T10:05:00Z",
    "methodology_version": "v0.1.0",
    "inputs_used": [
      "source_code",
      "test_code"
    ],
    "confidence": 0.9,
    "formula_version": "v1"
  },
  "derivation_source": {
    "acceptance_criteria_path": ".aimd/output/acceptance-criteria.json",
    "behavior_spec_path": ".aimd/output/behavior-spec.json"
  },
  "test_cases": [
    {
      "id": "TC-POST-001",
      "ac_ref": "AC-POST-001",
      "bhv_ref": "BHV-POST-001",
      "type": "integration",
      "framework": "vitest",
      "source_file": "test/modules/post/post.service.test.ts",
      "expected_outcome": "pass",
      "test_intent": "augmentation",
      "fail_mode": "assertion_fail",
      "source_evidence": "describe('createPost') > should create a new post successfully"
    },
    {
      "id": "TC-POST-002",
      "ac_ref": "AC-POST-002",
      "bhv_ref": "BHV-POST-002",
      "type": "integration",
      "framework": "vitest",
      "source_file": "test/modules/post/post.service.test.ts",
      "expected_outcome": "pass",
      "test_intent": "augmentation",
      "fail_mode": "assertion_fail",
      "source_evidence": "describe('queryPosts') > should filter posts by published status"
    },
    {
      "id": "TC-POST-003",
      "ac_ref": "AC-POST-003",
      "bhv_ref": "BHV-POST-003",
      "type": "integration",
      "framework": "vitest",
      "source_file": "test/modules/post/post.service.test.ts",
      "expected_outcome": "pass",
      "test_intent": "augmentation",
      "fail_mode": "assertion_fail",
      "source_evidence": "describe('getPostById') > should return null for non-existent post"
    },
    {
      "id": "TC-POST-004",
      "ac_ref": "AC-POST-004",
      "bhv_ref": "BHV-POST-004",
      "type": "integration",
      "framework": "vitest",
      "source_file": "test/modules/post/post.service.test.ts",
      "expected_outcome": "pass",
      "test_intent": "augmentation",
      "fail_mode": "assertion_fail",
      "source_evidence": "describe('updatePostById') > should throw error when user is not the author"
    },
    {
      "id": "TC-POST-005",
      "ac_ref": "AC-POST-005",
      "bhv_ref": "BHV-POST-005",
      "type": "integration",
      "framework": "vitest",
      "source_file": "test/modules/post/post.service.test.ts",
      "expected_outcome": "pass",
      "test_intent": "augmentation",
      "fail_mode": "assertion_fail",
      "source_evidence": "describe('deletePostById') > should throw error when user is not the author"
    },
    {
      "id": "TC-USER-001",
      "ac_ref": "AC-USER-001",
      "bhv_ref": "BHV-USER-001",
      "type": "integration",
      "framework": "vitest",
      "source_file": "test/modules/user/user.service.test.ts",
      "expected_outcome": "pass",
      "test_intent": "characterization",
      "source_evidence": "user.service email uniqueness (linkage-only; RED→GREEN runner scoped to post slice)"
    }
  ],
  "coverage": {
    "link_coverage": {
      "by_acceptance_criteria": 1,
      "threshold": 0.85
    },
    "test_pass_rate": 0
  }
}