{
  "meta": {
    "generated_at": "2026-06-08T00:00:00Z",
    "source_commit_sha": "0000000000000000000000000000000000000000",
    "methodology_version": "v0.20.0",
    "inputs_used": ["source_code"],
    "confidence": 0.95,
    "raw_confidence": 0.95,
    "warnings": ["기존 구현 존재(S2) → RED 대신 characterization(GREEN) / 요구사항2 TC-003=augmentation. 실 vitest run: 5 passed (GREEN)."]
  },
  "derivation_source": {
    "acceptance_criteria_path": ".aimd/output/acceptance-criteria.json",
    "behavior_spec_path": ".aimd/output/behavior-spec.json"
  },
  "test_cases": [
    {
      "id": "TC-NOTES-001",
      "ac_ref": "AC-NOTES-001",
      "bhv_ref": "BHV-NOTES-001",
      "type": "unit",
      "framework": "vitest",
      "source_file": "test/notes.test.js",
      "expected_outcome": "pass",
      "test_intent": "characterization"
    },
    {
      "id": "TC-NOTES-002",
      "ac_ref": "AC-NOTES-002",
      "bhv_ref": "BHV-NOTES-001",
      "type": "unit",
      "framework": "vitest",
      "source_file": "test/notes.test.js",
      "expected_outcome": "pass",
      "test_intent": "characterization"
    },
    {
      "id": "TC-NOTES-003",
      "ac_ref": "AC-NOTES-003",
      "bhv_ref": "BHV-NOTES-001",
      "type": "unit",
      "framework": "vitest",
      "source_file": "test/notes.test.js",
      "expected_outcome": "pass",
      "test_intent": "augmentation"
    }
  ],
  "coverage": {
    "link_coverage": {
      "by_acceptance_criteria": 1.0,
      "threshold": 0.85
    },
    "test_pass_rate": 1.0
  }
}
